{"schemaVersion":"work-item-status/v1","issue":{"repository":"chakrits/ai-agent-workflow","number":133,"url":"https://github.com/chakrits/ai-agent-workflow/issues/133"},"changeType":"framework_meta","risk":"medium","phase":"phase:human-review","taskState":"human-review","governingContract":"new-feature","contractVersion":"1","owner":{"kind":"agent","id":"developer-agent"},"evidence":[{"kind":"sdd","url":"docs/design.md","observedAt":"2026-08-01T00:00:00Z"}],"active":false,"createdAt":"2026-08-01T00:00:00Z","updatedAt":"2026-08-01T03:00:00Z","archivedAt":"2026-08-01T03:00:00Z","archiveReason":"alternate","supersedesDigest":"53e8dc1b2e97c4dcc3b4741be7042c8f3a194506d44a8200288e13d7ccbbb1bb","recordDigest":"908c1678b2831145dcb030bc1f9297e916baf3fc2956cad40eef9aae48006b50"}
